{
  "$schema": "https://raw.githubusercontent.com/KBMackenzie/COTL_JSONLoader/master/schema/follower-skin.json",
  "name": "My skin",
  "imagePath": "C:/path/to/image.png",
  "overrides": [
    {
      "name": "LEFT_ARM_SKIN",
      "rect": "0, 0, 128, 128"
    },
    {
      "name": "RIGHT_ARM_SKIN",
      "rect": "128, 128, 256, 256"
    }
  ],
  "colors": [
    [
      {
        "name": "LEFT_ARM_SKIN",
        "hex": "#FF0000"
      },
      {
        "name": "RIGHT_ARM_SKIN",
        "hex": "#FF0000"
      }
    ]
  ]
}
